primo_monitoraggio/risultati_risorse.csv

concorrenza,ripetizione,latenza_media_ms,latenza_max_ms,tok_sec_media,cpu_media_percent,cpu_max_percent,ram_media_mb,ram_max_mb,n_campioni
1,1,1294.1,1294.1,127.0,23.5,54.5,3299.8,3473.8,3
1,2,266.2,266.2,148.0,15.5,15.5,3031.8,3031.8,1
1,3,192.9,192.9,146.3,11.8,11.8,3390.9,3390.9,1
2,1,452.4,545.8,125.7,19.4,20.4,3216.1,3400.8,2
2,2,320.0,429.6,137.5,12.9,12.9,3332.2,3332.2,1
2,3,420.0,505.9,125.3,14.0,16.2,3382.2,3389.7,2
4,1,773.5,1342.8,96.2,12.8,13.8,3403.2,3407.1,3
4,2,808.3,1405.9,96.8,15.3,16.9,3359.2,3374.2,3
4,3,655.0,1179.3,102.1,13.6,15.0,3380.8,3393.2,3
8,1,1378.9,2829.1,92.4,15.0,18.8,3418.3,3441.9,6
8,2,1411.1,2875.7,83.5,15.1,21.2,3332.3,3361.1,6
8,3,1639.2,3189.7,92.3,13.0,17.5,3331.5,3391.6,7

primo_monitoraggio/REDME.md

[ Concorrenza: 1 ]
  rep 1/3 | lat: 1294.1 ms | CPU: 23.5% (max 54.5%) | RAM: 3299.8 MB (max 3473.8 MB)
  rep 2/3 | lat: 266.2 ms | CPU: 15.5% (max 15.5%) | RAM: 3031.8 MB (max 3031.8 MB)
  rep 3/3 | lat: 192.9 ms | CPU: 11.8% (max 11.8%) | RAM: 3390.9 MB (max 3390.9 MB)
[ Concorrenza: 2 ]
  rep 1/3 | lat: 452.4 ms | CPU: 19.4% (max 20.4%) | RAM: 3216.1 MB (max 3400.8 MB)
  rep 2/3 | lat: 320.0 ms | CPU: 12.9% (max 12.9%) | RAM: 3332.2 MB (max 3332.2 MB)
  rep 3/3 | lat: 420.0 ms | CPU: 14.0% (max 16.2%) | RAM: 3382.2 MB (max 3389.7 MB)
[ Concorrenza: 4 ]
  rep 1/3 | lat: 773.5 ms | CPU: 12.8% (max 13.8%) | RAM: 3403.2 MB (max 3407.1 MB)
  rep 2/3 | lat: 808.3 ms | CPU: 15.3% (max 16.9%) | RAM: 3359.2 MB (max 3374.2 MB)
  rep 3/3 | lat: 655.0 ms | CPU: 13.6% (max 15.0%) | RAM: 3380.8 MB (max 3393.2 MB)
[ Concorrenza: 8 ]
  rep 1/3 | lat: 1378.9 ms | CPU: 15.0% (max 18.8%) | RAM: 3418.3 MB (max 3441.9 MB)
  rep 2/3 | lat: 1411.1 ms | CPU: 15.1% (max 21.2%) | RAM: 3332.3 MB (max 3361.1 MB)
  rep 3/3 | lat: 1639.2 ms | CPU: 13.0% (max 17.5%) | RAM: 3331.5 MB (max 3391.6 MB)
======================================================================
Completato. Risultati in: risultati_risorse.csv